CPU:
   0x00000000 0x00: eax=0x0000000d ebx=0x756e6547 ecx=0x6c65746e edx=0x49656e69
   0x00000001 0x00: eax=0x000506c2 ebx=0x00200800 ecx=0x0edee3ff edx=0xbfebfbff
   0x00000002 0x00: eax=0x55035a01 ebx=0x00f0b2ff ecx=0x00000000 edx=0x00ca0000
   0x00000003 0x00: eax=0x00000000 ebx=0x00000000 ecx=0x00000000 edx=0x00000000
   0x00000004 0x00: eax=0x3c004121 ebx=0x01c0003f ecx=0x0000003f edx=0x00000000
   0x00000004 0x01: eax=0x3c004122 ebx=0x00c0003f ecx=0x0000007f edx=0x00000000
   0x00000004 0x02: eax=0x3c004143 ebx=0x01c0003f ecx=0x000001ff edx=0x00000000
   0x00000004 0x03: eax=0x3c07c163 ebx=0x03c0003f ecx=0x00002fff edx=0x00000002
   0x00000005 0x00: eax=0x00000040 ebx=0x03000040 ecx=0x00000003 edx=0x00001120
   0x00000006 0x00: eax=0x00000007 ebx=0x00000002 ecx=0x00000009 edx=0x00000000
   0x00000007 0x00: eax=0x00000000 ebx=0x23146285 ecx=0x1a400124 edx=0x00000000
   0x00000008 0x00: eax=0x00000000 ebx=0x00000000 ecx=0x00000000 edx=0x00000000
   0x00000009 0x00: eax=0x00000001 ebx=0x00000000 ecx=0x00000000 edx=0x00000000
   0x0000000a 0x00: eax=0x07300403 ebx=0x00000004 ecx=0x00000000 edx=0x00000603
   0x0000000b 0x00: eax=0x00000001 ebx=0x00000002 ecx=0x00000100 edx=0x00000000
   0x0000000b 0x01: eax=0x00000005 ebx=0x0000000c ecx=0x00000201 edx=0x00000000
   0x0000000c 0x00: eax=0x00000001 ebx=0x00000002 ecx=0x00000100 edx=0x00000000
   0x0000000d 0x00: eax=0x0000001b ebx=0x00000440 ecx=0x00000440 edx=0x00000000
   0x0000000d 0x01: eax=0x0000000f ebx=0x00000240 ecx=0x00000100 edx=0x00000000
   0x0000000d 0x03: eax=0x00000040 ebx=0x000003c0 ecx=0x00000000 edx=0x00000000
   0x0000000d 0x04: eax=0x00000040 ebx=0x00000400 ecx=0x00000000 edx=0x00000000
   0x0000000d 0x08: eax=0x00000000 ebx=0x00000000 ecx=0x00000000 edx=0x00000000
   0x80000000 0x00: eax=0x80000008 ebx=0x00000000 ecx=0x00000000 edx=0x00000000
   0x80000001 0x00: eax=0x00000000 ebx=0x00000000 ecx=0x00000021 edx=0x2c100800
   0x80000002 0x00: eax=0x65746e49 ebx=0x2952286c ecx=0x6f655820 edx=0x2952286e
   0x80000003 0x00: eax=0x55504320 ebx=0x20202020 ecx=0x20202020 edx=0x58202020
   0x80000004 0x00: eax=0x30383635 ebx=0x20402020 ecx=0x33332e33 edx=0x007a4847
   0x80000005 0x00: eax=0x00000000 ebx=0x00000000 ecx=0x00000000 edx=0x00000000
   0x80000006 0x00: eax=0x00000000 ebx=0x00000000 ecx=0x01006040 edx=0x00000000
   0x80000007 0x00: eax=0x00000000 ebx=0x00000000 ecx=0x00000000 edx=0x00000100
   0x80000008 0x00: eax=0x00003028 ebx=0x00000000 ecx=0x00000000 edx=0x00000000
   0x80860000 0x00: eax=0x00000000 ebx=0x00000000 ecx=0x00000000 edx=0x00000000
   0xc0000000 0x00: eax=0x00000000 ebx=0x00000000 ecx=0x00000000 edx=0x00000000
